{
  "schemaVersion": 1,
  "id": "firemonkey-3.9-firefox-157.0",
  "fm": {
    "version": "3.9",
    "range": "=3.9",
    "release": "v3.9",
    "sourceCommit": "8da260defe9857d4c8461f8fb78a18ee22f9e62f",
    "sourceUrl": "https://github.com/erosman/firemonkey/tree/8da260defe9857d4c8461f8fb78a18ee22f9e62f"
  },
  "firefox": {
    "version": "157.0",
    "range": "=157.0"
  },
  "help": {
    "url": "https://raw.githubusercontent.com/erosman/firemonkey/8da260defe9857d4c8461f8fb78a18ee22f9e62f/src/content/help.html",
    "retrievedAt": "2026-10-04T20:49:03.309644Z",
    "hash": "5ffba287528ea94536aee28b8a525fcb8837356742bf90d86a8d99db6ae0ea54"
  },
  "capabilities": {
    "api": [
      {
        "name": "unsafeWindow",
        "status": "supported",
        "contexts": [
          "user-script",
          "page"
        ],
        "evidence": [
          {
            "kind": "official",
            "reference": "https://raw.githubusercontent.com/erosman/firemonkey/8da260defe9857d4c8461f8fb78a18ee22f9e62f/src/content/api-gm.js",
            "hash": "b9a73579ced143768db7693ef3bdff5aea8c2d490ca8eca263396104bd7d008d",
            "description": "Grant-gated API mapping; info always available. Storage aliases have distinct sync/async semantics."
          },
          {
            "kind": "official",
            "reference": "https://raw.githubusercontent.com/erosman/firemonkey/8da260defe9857d4c8461f8fb78a18ee22f9e62f/src/content/userscript.js",
            "hash": "9e5416cac98cadcca2c5862b64a9d14bbf1b27d27c933198012f581ae97ba3e0",
            "description": "Page wrapper supplies unsafeWindow and info when unwrap is false; unwrap bypasses that wrapper."
          }
        ]
      },
      {
        "name": "GM.info",
        "status": "supported",
        "contexts": [
          "user-script",
          "page"
        ],
        "evidence": [
          {
            "kind": "official",
            "reference": "https://raw.githubusercontent.com/erosman/firemonkey/8da260defe9857d4c8461f8fb78a18ee22f9e62f/src/content/api-gm.js",
            "hash": "b9a73579ced143768db7693ef3bdff5aea8c2d490ca8eca263396104bd7d008d",
            "description": "Grant-gated API mapping; info always available. Storage aliases have distinct sync/async semantics."
          },
          {
            "kind": "official",
            "reference": "https://raw.githubusercontent.com/erosman/firemonkey/8da260defe9857d4c8461f8fb78a18ee22f9e62f/src/content/userscript.js",
            "hash": "9e5416cac98cadcca2c5862b64a9d14bbf1b27d27c933198012f581ae97ba3e0",
            "description": "Page wrapper supplies unsafeWindow and info when unwrap is false; unwrap bypasses that wrapper."
          }
        ]
      },
      {
        "name": "GM_info",
        "status": "supported",
        "contexts": [
          "user-script",
          "page"
        ],
        "evidence": [
          {
            "kind": "official",
            "reference": "https://raw.githubusercontent.com/erosman/firemonkey/8da260defe9857d4c8461f8fb78a18ee22f9e62f/src/content/api-gm.js",
            "hash": "b9a73579ced143768db7693ef3bdff5aea8c2d490ca8eca263396104bd7d008d",
            "description": "Grant-gated API mapping; info always available. Storage aliases have distinct sync/async semantics."
          },
          {
            "kind": "official",
            "reference": "https://raw.githubusercontent.com/erosman/firemonkey/8da260defe9857d4c8461f8fb78a18ee22f9e62f/src/content/userscript.js",
            "hash": "9e5416cac98cadcca2c5862b64a9d14bbf1b27d27c933198012f581ae97ba3e0",
            "description": "Page wrapper supplies unsafeWindow and info when unwrap is false; unwrap bypasses that wrapper."
          }
        ]
      },
      {
        "name": "GM.getValue",
        "status": "supported",
        "contexts": [
          "user-script"
        ],
        "evidence": [
          {
            "kind": "official",
            "reference": "https://raw.githubusercontent.com/erosman/firemonkey/8da260defe9857d4c8461f8fb78a18ee22f9e62f/src/content/api-gm.js",
            "hash": "b9a73579ced143768db7693ef3bdff5aea8c2d490ca8eca263396104bd7d008d",
            "description": "Grant-gated API mapping; info always available. Storage aliases have distinct sync/async semantics."
          }
        ]
      },
      {
        "name": "GM_getValue",
        "status": "supported",
        "contexts": [
          "user-script"
        ],
        "evidence": [
          {
            "kind": "official",
            "reference": "https://raw.githubusercontent.com/erosman/firemonkey/8da260defe9857d4c8461f8fb78a18ee22f9e62f/src/content/api-gm.js",
            "hash": "b9a73579ced143768db7693ef3bdff5aea8c2d490ca8eca263396104bd7d008d",
            "description": "Grant-gated API mapping; info always available. Storage aliases have distinct sync/async semantics."
          }
        ]
      },
      {
        "name": "GM.setValue",
        "status": "supported",
        "contexts": [
          "user-script"
        ],
        "evidence": [
          {
            "kind": "official",
            "reference": "https://raw.githubusercontent.com/erosman/firemonkey/8da260defe9857d4c8461f8fb78a18ee22f9e62f/src/content/api-gm.js",
            "hash": "b9a73579ced143768db7693ef3bdff5aea8c2d490ca8eca263396104bd7d008d",
            "description": "Grant-gated API mapping; info always available. Storage aliases have distinct sync/async semantics."
          }
        ]
      },
      {
        "name": "GM_setValue",
        "status": "supported",
        "contexts": [
          "user-script"
        ],
        "evidence": [
          {
            "kind": "official",
            "reference": "https://raw.githubusercontent.com/erosman/firemonkey/8da260defe9857d4c8461f8fb78a18ee22f9e62f/src/content/api-gm.js",
            "hash": "b9a73579ced143768db7693ef3bdff5aea8c2d490ca8eca263396104bd7d008d",
            "description": "Grant-gated API mapping; info always available. Storage aliases have distinct sync/async semantics."
          }
        ]
      },
      {
        "name": "GM.deleteValue",
        "status": "supported",
        "contexts": [
          "user-script"
        ],
        "evidence": [
          {
            "kind": "official",
            "reference": "https://raw.githubusercontent.com/erosman/firemonkey/8da260defe9857d4c8461f8fb78a18ee22f9e62f/src/content/api-gm.js",
            "hash": "b9a73579ced143768db7693ef3bdff5aea8c2d490ca8eca263396104bd7d008d",
            "description": "Grant-gated API mapping; info always available. Storage aliases have distinct sync/async semantics."
          }
        ]
      },
      {
        "name": "GM_deleteValue",
        "status": "supported",
        "contexts": [
          "user-script"
        ],
        "evidence": [
          {
            "kind": "official",
            "reference": "https://raw.githubusercontent.com/erosman/firemonkey/8da260defe9857d4c8461f8fb78a18ee22f9e62f/src/content/api-gm.js",
            "hash": "b9a73579ced143768db7693ef3bdff5aea8c2d490ca8eca263396104bd7d008d",
            "description": "Grant-gated API mapping; info always available. Storage aliases have distinct sync/async semantics."
          }
        ]
      },
      {
        "name": "GM.listValues",
        "status": "supported",
        "contexts": [
          "user-script"
        ],
        "evidence": [
          {
            "kind": "official",
            "reference": "https://raw.githubusercontent.com/erosman/firemonkey/8da260defe9857d4c8461f8fb78a18ee22f9e62f/src/content/api-gm.js",
            "hash": "b9a73579ced143768db7693ef3bdff5aea8c2d490ca8eca263396104bd7d008d",
            "description": "Grant-gated API mapping; info always available. Storage aliases have distinct sync/async semantics."
          }
        ]
      },
      {
        "name": "GM_listValues",
        "status": "supported",
        "contexts": [
          "user-script"
        ],
        "evidence": [
          {
            "kind": "official",
            "reference": "https://raw.githubusercontent.com/erosman/firemonkey/8da260defe9857d4c8461f8fb78a18ee22f9e62f/src/content/api-gm.js",
            "hash": "b9a73579ced143768db7693ef3bdff5aea8c2d490ca8eca263396104bd7d008d",
            "description": "Grant-gated API mapping; info always available. Storage aliases have distinct sync/async semantics."
          }
        ]
      },
      {
        "name": "GM.notification",
        "status": "supported",
        "contexts": [
          "user-script"
        ],
        "evidence": [
          {
            "kind": "official",
            "reference": "https://raw.githubusercontent.com/erosman/firemonkey/8da260defe9857d4c8461f8fb78a18ee22f9e62f/src/content/api-gm.js",
            "hash": "b9a73579ced143768db7693ef3bdff5aea8c2d490ca8eca263396104bd7d008d",
            "description": "Grant-gated API mapping; info always available. Storage aliases have distinct sync/async semantics."
          }
        ]
      },
      {
        "name": "GM_notification",
        "status": "supported",
        "contexts": [
          "user-script"
        ],
        "evidence": [
          {
            "kind": "official",
            "reference": "https://raw.githubusercontent.com/erosman/firemonkey/8da260defe9857d4c8461f8fb78a18ee22f9e62f/src/content/api-gm.js",
            "hash": "b9a73579ced143768db7693ef3bdff5aea8c2d490ca8eca263396104bd7d008d",
            "description": "Grant-gated API mapping; info always available. Storage aliases have distinct sync/async semantics."
          }
        ]
      },
      {
        "name": "GM.openInTab",
        "status": "supported",
        "contexts": [
          "user-script"
        ],
        "evidence": [
          {
            "kind": "official",
            "reference": "https://raw.githubusercontent.com/erosman/firemonkey/8da260defe9857d4c8461f8fb78a18ee22f9e62f/src/content/api-gm.js",